{
  "$schema": "https://json-schema.org/draft/2020-12/schema",
  "$id": "docs-pack/nav.schema.json",
  "title": "Docs site navigation (docs pack 1.0.0)",
  "type": "object",
  "required": ["pluginId", "displayName", "packageName", "repoUrl", "siteUrl", "playground", "sections"],
  "additionalProperties": false,
  "properties": {
    "$schema": { "type": "string" },
    "pluginId": { "type": "string", "pattern": "^[a-z0-9]+(-[a-z0-9]+)*$" },
    "displayName": { "type": "string", "minLength": 2 },
    "packageName": { "type": "string" },
    "repoUrl": { "type": "string", "format": "uri" },
    "siteUrl": { "type": "string", "format": "uri" },
    "locales": {
      "type": "array",
      "const": ["en", "ro", "hu", "es", "fr", "de", "pt"]
    },
    "playground": {
      "type": "object",
      "required": ["component", "variant"],
      "additionalProperties": false,
      "properties": {
        "component": { "type": "string", "description": "Exported name of the main component" },
        "variant": { "enum": ["standard", "stage"] }
      }
    },
    "sections": {
      "type": "array",
      "minItems": 9,
      "maxItems": 9,
      "prefixItems": [
        { "$ref": "#/$defs/section", "properties": { "id": { "const": "getting-started" } } },
        { "$ref": "#/$defs/section", "properties": { "id": { "const": "features" } } },
        { "$ref": "#/$defs/section", "properties": { "id": { "const": "demos" } } },
        { "$ref": "#/$defs/section", "properties": { "id": { "const": "reference" } } },
        { "$ref": "#/$defs/section", "properties": { "id": { "const": "customization" } } },
        { "$ref": "#/$defs/section", "properties": { "id": { "const": "guides" } } },
        { "$ref": "#/$defs/section", "properties": { "id": { "const": "integrations" } } },
        { "$ref": "#/$defs/section", "properties": { "id": { "const": "migration" } } },
        { "$ref": "#/$defs/section", "properties": { "id": { "const": "discover-more" } } }
      ],
      "items": false
    }
  },
  "$defs": {
    "section": {
      "type": "object",
      "required": ["id", "labelKey", "items"],
      "additionalProperties": false,
      "properties": {
        "id": { "type": "string" },
        "labelKey": { "type": "string", "pattern": "^nav\\." },
        "items": { "type": "array", "minItems": 1, "items": { "oneOf": [ { "$ref": "#/$defs/item" }, { "$ref": "#/$defs/group" } ] } }
      }
    },
    "group": {
      "type": "object",
      "required": ["type", "labelKey", "items"],
      "additionalProperties": false,
      "properties": {
        "type": { "const": "group" },
        "labelKey": { "type": "string", "pattern": "^nav\\." },
        "items": { "type": "array", "minItems": 1, "items": { "$ref": "#/$defs/item" } }
      }
    },
    "item": {
      "type": "object",
      "required": ["id", "labelKey", "path", "page"],
      "additionalProperties": false,
      "properties": {
        "id": { "type": "string", "pattern": "^[a-z0-9]+(-[a-z0-9]+)*$" },
        "labelKey": { "type": "string", "pattern": "^nav\\." },
        "path": { "type": "string", "pattern": "^/([a-z0-9-]+/)*$" },
        "page": { "type": "string", "description": "content/pages/{page}.tsx and locales/{lng}/pages/{page}.json" },
        "template": { "enum": ["T1","T2","T3","T4","T5","T6","T7","T8","T9","T10","T11","T12","T13","T14","T15","T16"] },
        "layout": { "enum": ["default", "wide"], "default": "default" },
        "badge": { "enum": ["new", "preview", "beta", "deprecated"] },
        "symbols": { "type": "array", "items": { "type": "string" }, "description": "API symbols this page documents (capability pages)" }
      }
    }
  }
}
