{
  "$schema": "./nav.schema.json",
  "pluginId": "react-scheduler",
  "displayName": "React Scheduler",
  "packageName": "@kingtech/react-scheduler",
  "repoUrl": "https://github.com/kiralygyula92/react-scheduler",
  "siteUrl": "https://react-schedulerkit.vercel.app",
  "locales": ["en", "ro", "hu", "es", "fr", "de", "pt"],
  "playground": {
    "component": "Scheduler",
    "variant": "standard"
  },
  "sections": [
    {
      "id": "getting-started",
      "labelKey": "nav.gettingStarted",
      "items": [
        {
          "id": "overview",
          "labelKey": "nav.overview",
          "path": "/",
          "page": "getting-started/overview",
          "template": "T1"
        },
        {
          "id": "installation",
          "labelKey": "nav.installation",
          "path": "/getting-started/installation/",
          "page": "getting-started/installation",
          "template": "T2"
        },
        {
          "id": "usage",
          "labelKey": "nav.usage",
          "path": "/getting-started/usage/",
          "page": "getting-started/usage",
          "template": "T2"
        },
        {
          "id": "ai-context",
          "labelKey": "nav.aiContext",
          "path": "/getting-started/ai-context/",
          "page": "getting-started/ai-context",
          "template": "T3"
        },
        {
          "id": "requirements",
          "labelKey": "nav.requirements",
          "path": "/getting-started/requirements/",
          "page": "getting-started/requirements",
          "template": "T2"
        },
        {
          "id": "faq",
          "labelKey": "nav.faq",
          "path": "/getting-started/faq/",
          "page": "getting-started/faq",
          "template": "T2"
        },
        {
          "id": "support",
          "labelKey": "nav.support",
          "path": "/getting-started/support/",
          "page": "getting-started/support",
          "template": "T2"
        },
        {
          "id": "versions",
          "labelKey": "nav.versions",
          "path": "/getting-started/versions/",
          "page": "getting-started/versions",
          "template": "T4"
        }
      ]
    },
    {
      "id": "features",
      "labelKey": "nav.features",
      "items": [
        {
          "id": "all-features",
          "labelKey": "nav.allFeatures",
          "path": "/all-features/",
          "page": "features/all-features",
          "template": "T5"
        },
        {
          "type": "group",
          "labelKey": "nav.groups.coreFeatures",
          "items": [
            {
              "id": "scheduler-and-views",
              "labelKey": "nav.capabilities.schedulerAndViews",
              "path": "/scheduler-and-views/",
              "page": "features/scheduler-and-views",
              "template": "T6",
              "symbols": ["Scheduler", "ListView", "TimelineView"]
            },
            {
              "id": "shifts-and-dates",
              "labelKey": "nav.capabilities.shiftsAndDates",
              "path": "/shifts-and-dates/",
              "page": "features/shifts-and-dates",
              "template": "T6",
              "symbols": ["useShiftModel", "ShiftHeader"]
            },
            {
              "id": "list-view",
              "labelKey": "nav.capabilities.listView",
              "path": "/list-view/",
              "page": "features/list-view",
              "template": "T6",
              "symbols": ["ListView", "ListCard", "ListOptions"]
            },
            {
              "id": "timeline-view",
              "labelKey": "nav.capabilities.timelineView",
              "path": "/timeline-view/",
              "page": "features/timeline-view",
              "template": "T6",
              "symbols": ["TimelineView", "TimeGrid", "TimelineOptions", "useTimelineLayout"]
            }
          ]
        },
        {
          "type": "group",
          "labelKey": "nav.groups.interaction",
          "items": [
            {
              "id": "items-and-levels",
              "labelKey": "nav.capabilities.itemsAndLevels",
              "path": "/items-and-levels/",
              "page": "features/items-and-levels",
              "template": "T6",
              "symbols": ["classicLevels", "classicTags", "LevelPill", "TagPill"]
            },
            {
              "id": "pinning",
              "labelKey": "nav.capabilities.pinning",
              "path": "/pinning/",
              "page": "features/pinning",
              "template": "T6",
              "symbols": ["PinnedStrip", "PinnedChip", "PinningOptions", "usePinOnPass"]
            },
            {
              "id": "navigation",
              "labelKey": "nav.capabilities.navigation",
              "path": "/navigation/",
              "page": "features/navigation",
              "template": "T6",
              "symbols": ["ShiftNavButton", "useShiftNavigation", "NavState"]
            },
            {
              "id": "now-indicator",
              "labelKey": "nav.capabilities.nowIndicator",
              "path": "/now-indicator/",
              "page": "features/now-indicator",
              "template": "T6",
              "symbols": ["NowIndicator", "useNow"]
            },
            {
              "id": "overflow",
              "labelKey": "nav.capabilities.overflow",
              "path": "/overflow/",
              "page": "features/overflow",
              "template": "T6",
              "symbols": ["OverflowDialog", "OverflowTable", "MoreChip", "defaultOverflowColumns"]
            },
            {
              "id": "item-detail",
              "labelKey": "nav.capabilities.itemDetail",
              "path": "/item-detail/",
              "page": "features/item-detail",
              "template": "T6",
              "symbols": ["DefaultItemDetail", "Tooltip"]
            }
          ]
        },
        {
          "type": "group",
          "labelKey": "nav.groups.displayLayout",
          "items": [
            {
              "id": "compact",
              "labelKey": "nav.capabilities.compact",
              "path": "/compact/",
              "page": "features/compact",
              "template": "T6",
              "symbols": ["useCompact"]
            },
            {
              "id": "states",
              "labelKey": "nav.capabilities.states",
              "path": "/states/",
              "page": "features/states",
              "template": "T6",
              "symbols": ["EmptyState", "LoadingState", "ErrorState"]
            },
            {
              "id": "motion",
              "labelKey": "nav.capabilities.motion",
              "path": "/motion/",
              "page": "features/motion",
              "template": "T6"
            }
          ]
        },
        {
          "type": "group",
          "labelKey": "nav.groups.advanced",
          "items": [
            {
              "id": "events-and-middleware",
              "labelKey": "nav.capabilities.eventsAndMiddleware",
              "path": "/events-and-middleware/",
              "page": "features/events-and-middleware",
              "template": "T6",
              "symbols": ["Middleware"]
            },
            {
              "id": "data-modes-and-ssr",
              "labelKey": "nav.capabilities.dataModesAndSsr",
              "path": "/data-modes-and-ssr/",
              "page": "features/data-modes-and-ssr",
              "template": "T6"
            },
            {
              "id": "accessibility-and-keyboard",
              "labelKey": "nav.capabilities.accessibilityAndKeyboard",
              "path": "/accessibility-and-keyboard/",
              "page": "features/accessibility-and-keyboard",
              "template": "T6"
            },
            {
              "id": "headless-api",
              "labelKey": "nav.capabilities.headlessApi",
              "path": "/headless-api/",
              "page": "features/headless-api",
              "template": "T6",
              "symbols": ["createScheduler", "useScheduler", "SchedulerController"]
            }
          ]
        }
      ]
    },
    {
      "id": "demos",
      "labelKey": "nav.demos",
      "items": [
        {
          "id": "demos",
          "labelKey": "nav.demosIndex",
          "path": "/demos/",
          "page": "demos/index",
          "template": "T7"
        },
        {
          "id": "baseline-day",
          "labelKey": "nav.demos.baselineDay",
          "path": "/demos/baseline-day/",
          "page": "demos/baseline-day",
          "template": "T8",
          "layout": "wide"
        },
        {
          "id": "empty",
          "labelKey": "nav.demos.empty",
          "path": "/demos/empty/",
          "page": "demos/empty",
          "template": "T8",
          "layout": "wide"
        },
        {
          "id": "sparse",
          "labelKey": "nav.demos.sparse",
          "path": "/demos/sparse/",
          "page": "demos/sparse",
          "template": "T8",
          "layout": "wide"
        },
        {
          "id": "crowded",
          "labelKey": "nav.demos.crowded",
          "path": "/demos/crowded/",
          "page": "demos/crowded",
          "template": "T8",
          "layout": "wide"
        },
        {
          "id": "night-shift",
          "labelKey": "nav.demos.nightShift",
          "path": "/demos/night-shift/",
          "page": "demos/night-shift",
          "template": "T8",
          "layout": "wide"
        },
        {
          "id": "past-date",
          "labelKey": "nav.demos.pastDate",
          "path": "/demos/past-date/",
          "page": "demos/past-date",
          "template": "T8",
          "layout": "wide"
        },
        {
          "id": "pinned-many",
          "labelKey": "nav.demos.pinnedMany",
          "path": "/demos/pinned-many/",
          "page": "demos/pinned-many",
          "template": "T8",
          "layout": "wide"
        },
        {
          "id": "large",